{
  "merchant": "스타벅스 서면점",
  "amount": 11300,
  "category": "카페",
  "date": "2026-09-11T14:32",
  "memo": "아메리카노 4,500원 / 샌드위치 6,800원",
  "source": "ocr",
  "placeName": "스타벅스 서면점",
  "items": [
    { "name": "아메리카노", "price": 4500 },
    { "name": "샌드위치", "price": 6800 }
  ],
  "features": {
    "hour": 14,
    "timeBand": "오후",
    "isFoodRelated": true,
    "transactionCount": 1
  }
}
